{
  "schemaVersion": "telemetry-contribution-v0.2",
  "consentVersion": "privacy-safe-telemetry-v0.2",
  "status": "implementation_disabled",
  "synthetic": false,
  "datasetId": "dataset:v1:dddddddddddddddddddddddddddddddddddddddddddddddddddddddddddddddd",
  "partIndex": 1,
  "partCount": 1,
  "completeness": "complete",
  "createdAt": "2026-07-25T13:00:00.000Z",
  "coveredAt": {
    "startAt": "2026-07-25T12:00:00.000Z",
    "endAt": "2026-07-25T12:30:00.000Z"
  },
  "clientPlatform": "macos",
  "providerPolicyEpoch": "openai_agentic_pool_2026_07_09",
  "usageEvents": [
    {
      "schemaVersion": "usage-event-v0.2",
      "accountTrackId": "account-track:v1:aaaaaaaaaaaaaaaaaaaaaaaaaaaaaaaaaaaaaaaaaaaaaaaaaaaaaaaaaaaaaaaa",
      "eventTime": "2026-07-25T12:05:00.000Z",
      "provider": "openai_codex",
      "modelId": "gpt-5.6-sol",
      "modelRecognition": "recognized",
      "modelFingerprint": null,
      "billingSurface": "chatgpt_subscription",
      "speedMode": "fast",
      "apiServiceTier": "priority",
      "reasoningEffort": "xhigh",
      "components": {
        "inputUncachedTokens": 100,
        "inputCacheReadTokens": 900,
        "inputCacheWriteTokens": 0,
        "inputCacheWrite5mTokens": null,
        "inputCacheWrite1hTokens": null,
        "outputTextTokens": 50,
        "outputReasoningTokens": 25,
        "outputCombinedTokens": null
      },
      "totalInputContextTokens": 1000,
      "surface": "local_interactive_unclassified",
      "agentScope": "root",
      "lineageDisposition": "standalone",
      "toolClassCounts": {
        "webSearch": 0,
        "fileSearch": 0,
        "codeInterpreter": 0,
        "hostedShell": 0,
        "computerUse": 0,
        "mcp": 0,
        "applyPatch": 0,
        "localShell": 0,
        "subagent": 0,
        "toolGateway": 0,
        "other": 0,
        "unknown": 0
      },
      "outcome": "completed",
      "eventId": "event:v2:eeeeeeeeeeeeeeeeeeeeeeeeeeeeeeeeeeeeeeeeeeeeeeeeeeeeeeeeeeeeeeee",
      "accountingDiagnostic": {
        "status": "untrusted_diagnostic",
        "sourceSchemaVersion": "telemetry-contribution-v0.1",
        "estimatedApiCostUsd": "999.000000",
        "pricingCoveragePercent": 100,
        "unknownBillableUnits": 0,
        "priceBasis": "current_api_prices"
      }
    }
  ],
  "quotaSnapshots": [
    {
      "schemaVersion": "quota-snapshot-v0.2",
      "accountTrackId": "account-track:v1:aaaaaaaaaaaaaaaaaaaaaaaaaaaaaaaaaaaaaaaaaaaaaaaaaaaaaaaaaaaaaaaa",
      "observedTime": "2026-07-25T12:10:00.000Z",
      "receivedTime": "2026-07-25T12:10:01.000Z",
      "provider": "openai_codex",
      "planType": "pro",
      "planVariant": "pro-20x",
      "limitId": "codex",
      "slot": "seven_day",
      "usedPercent": 31,
      "displayPrecision": 0,
      "windowDurationMinutes": 10080,
      "resetsAt": "2026-07-31T12:00:00.000Z",
      "snapshotSource": "rollout",
      "providerSurface": "account_shared_unallocated",
      "snapshotId": "snapshot:v2:ffffffffffffffffffffffffffffffffffffffffffffffffffffffffffffffff"
    }
  ],
  "activityMarkers": [],
  "accountingDiagnostic": {
    "status": "untrusted_diagnostic",
    "sourceSchemaVersion": "telemetry-contribution-v0.1",
    "estimatedApiCostUsd": "999.000000",
    "pricedEventCoveragePercent": 100,
    "unknownModelEventCount": 0,
    "unknownBillableUnits": 0,
    "priceBasis": "current_api_prices"
  }
}
